{"rows":12,"cols":24,"pattern":[true,false,false,false,true,false,false,false,true,false,false,false,true,false,false,false,true,false,false,false,true,false,true,false,true,true,true,true,true,true,true,true,true,true,true,true,true,true,true,true,true,true,true,true,true,true,true,true,false,false,true,false,false,false,true,false,false,false,true,false,false,false,true,false,false,false,true,false,false,false,true,false,true,false,false,false,true,false,true,false,true,false,false,false,true,false,true,false,true,false,false,false,true,false,false,false,false,false,false,true,false,false,false,true,false,false,false,true,false,false,false,true,false,false,false,true,false,false,false,true,false,true,false,false,false,true,false,false,false,true,false,false,false,true,false,false,false,true,false,false,false,true,false,false,false,false,false,false,false,false,false,false,false,false,false,false,false,false,false,false,false,false,false,false,false,false,false,false,false,false,false,false,false,false,false,false,false,false,false,false,false,false,false,false,false,false,false,false,false,false,false,false,false,false,false,false,false,false,false,false,false,false,false,false,false,false,false,false,false,false,false,false,false,false,false,false,false,false,false,false,false,false,false,false,false,false,false,false,false,false,false,false,false,false,false,false,false,false,false,false,false,false,false,false,false,false,false,false,false,false,false,false,false,false,false,false,false,false,false,false,false,false,false,false,false,false,false,false,false,false],"settings":{"bpm":160,"primeValue":3,"fractalDepth":5,"swingAmount":0,"accentEvery":4,"autoEvery":4,"autoFractal":false,"humanizeOn":false,"isLocked":false,"fractalDensity":60}}
