{"rows": 12, "cols": 24, "pattern": [true, false, false, false, false, true, false, false, false, false, true, false, true, false, false, false, false, true, false, false, false, true, false, false, false, false, false, false, true, false, false, false, false, false, false, true, false, false, false, false, false, false, true, false, false, false, false, false, true, false, true, true, false, false, true, true, false, true, false, false, true, false, false, true, false, true, true, false, false, true, true, false, true, false, false, false, true, false, false, true, false, true, false, true, false, false, true, false, false, false, true, false, true, true, false, false, false, false, false, true, false, false, true, true, false, false, true, false, false, true, false, false, false, true, true, false, true, false, false, false, false, false, true, false, false, true, false, false, false, true, false, false, true, false, false, false, true, false, false, true, false, false, false, true, false, false, false, false, true, false, false, false, false, false, false, false, false, true, false, false, false, false, false, false, false, false, true, false, false, false, false, true, false, false, false, false, false, false, false, false, true, false, false, false, false, false, false, false, false, true, false, false, false, false, true, false, false, false, false, false, false, false, true, false, false, false, false, true, false, false, false, false, false, false, true, true, true, false, false, false, false, false, false, false, true, true, false, false, false, true, false, false, false, false, false, false, false, true, false, false, false, false, false, false, false, false, true, false, true, false, false, true, false, false, false, false, false, false, false, true, true, false, false, false, false, false, false, false, true, false, false, true, false, true, false, false, false, false, false, false, false, true, false, true, false, false, true, false], "settings": {"bpm": 96, "primeValue": 7, "fractalDepth": 6, "swingAmount": 4, "accentEvery": 5, "autoEvery": 4, "autoFractal": true, "humanizeOn": true, "isLocked": false, "fractalDensity": 52, "soundBankId": "samples-industrial"}}